{
  "$schema": "https://json-schema.org/draft/2020-12/schema",
  "$id": "https://bigriversoftware.github.io/RaceCountdown/events.schema.json",
  "title": "Race Countdown event feed",
  "type": "object",
  "required": [
    "schemaVersion",
    "generatedUtc",
    "series",
    "tracks",
    "events"
  ],
  "additionalProperties": false,
  "properties": {
    "schemaVersion": {
      "const": 1
    },
    "generatedUtc": {
      "$ref": "#/$defs/utcInstant"
    },
    "series": {
      "type": "array",
      "items": {
        "$ref": "#/$defs/series"
      }
    },
    "tracks": {
      "type": "array",
      "items": {
        "$ref": "#/$defs/track"
      }
    },
    "events": {
      "type": "array",
      "items": {
        "$ref": "#/$defs/event"
      }
    }
  },
  "$defs": {
    "id": {
      "type": "string",
      "pattern": "^[a-z0-9]+(-[a-z0-9]+)*$"
    },
    "utcInstant": {
      "type": "string",
      "pattern": "^\\d{4}-\\d{2}-\\d{2}T\\d{2}:\\d{2}:\\d{2}Z$"
    },
    "localDateTime": {
      "type": "string",
      "pattern": "^\\d{4}-\\d{2}-\\d{2}T\\d{2}:\\d{2}:\\d{2}$"
    },
    "date": {
      "type": "string",
      "pattern": "^\\d{4}-\\d{2}-\\d{2}$"
    },
    "duration": {
      "type": "string",
      "pattern": "^(\\d+\\.)?\\d{2}:\\d{2}:\\d{2}$"
    },
    "series": {
      "type": "object",
      "required": [
        "id",
        "name",
        "shortName",
        "accentColour"
      ],
      "additionalProperties": false,
      "properties": {
        "id": {
          "$ref": "#/$defs/id"
        },
        "name": {
          "type": "string",
          "minLength": 1
        },
        "shortName": {
          "type": [
            "string",
            "null"
          ]
        },
        "accentColour": {
          "type": "string",
          "pattern": "^#[0-9A-Fa-f]{6}$"
        }
      }
    },
    "track": {
      "type": "object",
      "required": [
        "id",
        "name",
        "location",
        "countryCode",
        "timeZoneId",
        "latitude",
        "longitude"
      ],
      "additionalProperties": false,
      "properties": {
        "id": {
          "$ref": "#/$defs/id"
        },
        "name": {
          "type": "string",
          "minLength": 1
        },
        "location": {
          "type": "string"
        },
        "countryCode": {
          "type": "string",
          "pattern": "^[A-Z]{2}$"
        },
        "timeZoneId": {
          "type": "string",
          "pattern": "^[A-Za-z_]+(/[A-Za-z0-9_+-]+)+$"
        },
        "latitude": {
          "type": "number",
          "minimum": -90,
          "maximum": 90
        },
        "longitude": {
          "type": "number",
          "minimum": -180,
          "maximum": 180
        }
      }
    },
    "event": {
      "type": "object",
      "required": [
        "id",
        "seriesId",
        "trackId",
        "name",
        "startDate",
        "endDate",
        "status",
        "sessions"
      ],
      "additionalProperties": false,
      "properties": {
        "id": {
          "$ref": "#/$defs/id"
        },
        "seriesId": {
          "$ref": "#/$defs/id"
        },
        "trackId": {
          "$ref": "#/$defs/id"
        },
        "name": {
          "type": "string",
          "minLength": 1
        },
        "startDate": {
          "anyOf": [
            {
              "$ref": "#/$defs/date"
            },
            {
              "type": "null"
            }
          ]
        },
        "endDate": {
          "anyOf": [
            {
              "$ref": "#/$defs/date"
            },
            {
              "type": "null"
            }
          ]
        },
        "status": {
          "enum": [
            "Confirmed",
            "Provisional",
            "DateTba",
            "Cancelled"
          ]
        },
        "sessions": {
          "type": "array",
          "items": {
            "$ref": "#/$defs/session"
          }
        }
      },
      "if": {
        "properties": {
          "status": {
            "const": "Confirmed"
          }
        }
      },
      "then": {
        "properties": {
          "startDate": {
            "$ref": "#/$defs/date"
          },
          "endDate": {
            "$ref": "#/$defs/date"
          }
        }
      }
    },
    "session": {
      "type": "object",
      "required": [
        "id",
        "name",
        "type",
        "startUtc",
        "startLocal",
        "estimatedDuration"
      ],
      "additionalProperties": false,
      "properties": {
        "id": {
          "$ref": "#/$defs/id"
        },
        "name": {
          "type": "string",
          "minLength": 1
        },
        "type": {
          "enum": [
            "Practice",
            "Qualifying",
            "Shootout",
            "Race"
          ]
        },
        "startUtc": {
          "$ref": "#/$defs/utcInstant"
        },
        "startLocal": {
          "$ref": "#/$defs/localDateTime"
        },
        "estimatedDuration": {
          "anyOf": [
            {
              "$ref": "#/$defs/duration"
            },
            {
              "type": "null"
            }
          ]
        }
      }
    }
  }
}
